{
  "$schema": "https://json-schema.org/draft/2020-12/schema",
  "$id": "https://github.com/CatholicOS/cmddr/schema/document.schema.json",
  "title": "CMDDR Document",
  "description": "One concrete magisterial document / speech. References a Genre. May be fully described by its Genre alone (no Assessments) or carry one Assessment per notable passage.",
  "type": "object",
  "additionalProperties": false,
  "required": ["id", "title", "genre", "issuerId", "issuerType", "idStatus"],
  "properties": {
    "id": {
      "type": "string",
      "pattern": "^mag:[a-z0-9-]+/[a-z0-9]+(-[a-z0-9]+)*$",
      "description": "Canonical identifier: 'mag:{issuer}/{incipit-slug}-{year}', or 'mag:{issuer}/{series-id}-{occasion-year}' when series is set. The issuer segment is the local part of issuerId. The exact form is fixed by idStatus below. See the identifiers spec §3 and the messages spec §3."
    },
    "title": { "type": "string" },
    "genre": {
      "type": ["string", "null"],
      "description": "Foreign key -> genre.id in data/genres.json. Null when the source genre has no Genre Registry row yet; sourceGenreLabel then records the raw label."
    },
    "issuerId": {
      "type": "string",
      "pattern": "^(rp|oec):[a-z0-9-]+$",
      "description": "Prefixed registry id of the concrete issuer, e.g. 'rp:john-paul-ii', 'oec:vatican-ii'."
    },
    "issuerType": {
      "enum": ["ecumenical-council", "pope", "bishop"],
      "description": "Role/capacity of the issuer. Drives the computed-infallibility rule; must be one of the genre's issuerTypes."
    },
    "promulgatedBy": {
      "type": "string",
      "pattern": "^rp:[a-z0-9-]+$",
      "description": "Optional prefixed id of the pope who promulgated the document, when distinct from the issuer. Does not change issuerType."
    },
    "incipit": { "type": "string", "description": "The incipit as printed by the source, unnormalised (e.g. 'Adiutricem populi')." },
    "incipitLang": { "type": "string", "pattern": "^[a-z]{2}$", "description": "ISO 639-1 language of the incipit; vernacular incipits are first-class." },
    "idStatus": { "enum": ["minted", "provisional"], "description": "'minted' ids are permanent; 'provisional' ids may be re-minted." },
    "sigla": { "type": "string", "pattern": "^[A-Z][A-Za-z]{0,7}$", "description": "Conventional scholarly abbreviation (EV, LG, GS). Display only, never a key." },
    "sourceGenreLabel": { "type": "string", "description": "Genre label exactly as the source prints it (e.g. 'Enciclica', 'Protesta')." },
    "source": {
      "type": "object",
      "additionalProperties": false,
      "properties": {
        "url": { "type": ["string", "null"] },
        "shelf": { "type": ["string", "null"] },
        "alsoShelvedAs": { "type": "array", "items": { "type": "string" },
          "description": "Other vatican.va shelves the same document is filed under; the shelves are not disjoint." },
        "languages": { "type": "array", "items": { "type": "string" } },
        "retrieved": { "type": "string", "format": "date" }
      }
    },
    "date": {
      "type": "string",
      "format": "date",
      "description": "Promulgation date (ISO 8601)."
    },
    "scope": {
      "enum": ["universal", "local"],
      "description": "Overrides genre.defaultScope. Juridical reach of the act (whom it binds), not its addressee; for an apostolic-letter, whose genre spans universal teaching and local governance, expected to be set per document rather than inherited."
    },
    "characteristics": {
      "type": "array",
      "uniqueItems": true,
      "items": { "enum": ["apostolic-constitution", "dogmatic-definition", "motu-proprio"] },
      "description": "Non-exclusive document-level metadata; each entry must be among the genre's allowedCharacteristics in data/genres.json. 'dogmatic-definition' asserts the document contains an ex cathedra definition and must be backed by a Table 2 assessment with register=extraordinary and intent=definitive. 'motu-proprio' records a mode of issuance (on the pope's own initiative), not a genre, and makes no authority claim."
    },
    "keywords": {
      "type": "array",
      "uniqueItems": true,
      "items": { "type": "string", "pattern": "^[a-z0-9]+(-[a-z0-9]+)*$" },
      "description": "Descriptive subject tags -> keyword.id in data/keywords.json. Never authority-bearing: unlike characteristics, a keyword makes no claim about the document's register or definitiveness, and no invariant other than vocabulary membership reads it."
    },
    "actKind": {
      "enum": ["teaching", "governance", "liturgical"],
      "description": "What kind of act the document is. Absent means 'teaching'. 'governance' is a juridical act (erecting a diocese, proclaiming a patron, approving statutes); 'liturgical' is a rite or blessing (an Urbi et Orbi). The operative act is then not a statement Table 2 assesses and the genre's default register does not describe it; a passage that does teach (the address before an Urbi et Orbi blessing) is still assessed per statement, so the flag never forbids an Assessment. Never authority-bearing: like keywords, it makes no claim about register or definitiveness, and no invariant reads it."
    },
    "series": {
      "type": "object",
      "additionalProperties": false,
      "required": ["id", "year"],
      "properties": {
        "id": {
          "type": "string",
          "pattern": "^[a-z0-9]+(-[a-z0-9]+)*$",
          "description": "Foreign key -> series.id in data/series.json: the occasion the series belongs to (e.g. 'world-day-of-peace'). It is the slug segment of the document's id."
        },
        "year": {
          "type": "integer",
          "minimum": 1000,
          "maximum": 9999,
          "description": "The year of the occasion as the title prints it ('LVIII Giornata Mondiale della Pace 2025' -> 2025), which is the year segment of the document's id. Distinct from the year of date: the 2025 Peace message is signed 8 December 2024. Never derived from date; where the title prints none, a curated row supplies it."
        },
        "ordinal": {
          "type": "integer",
          "minimum": 1,
          "description": "The document's number within the series, as the source prints it (the 'LI' of 'LI Giornata Mondiale della Pace', the '110' of '110ª Giornata Mondiale del Migrante'). Omit wherever the source prints none, whether the series is dated rather than numbered (the Lent messages) or a single title inside a numbered series lacks one. Never computed from the vocabulary row's firstYear; invariant 24 checks the two against each other where both are present."
        }
      },
      "description": "Membership in a numbered or dated annual series (World Day of Peace, World Communications Day, Lent message...). A document with series set takes the series-form id 'mag:{issuer}/{series-id}-{year}' and is minted without needing an incipit. Otherwise discovery metadata only, with no bearing on register, ceiling or assent; invariants 23 (vocabulary membership), 10, 12 (id round-trip) and 24 (ordinal against firstYear) read it."
    },
    "descriptiveTitle": {
      "enum": ["dogmatic", "pastoral"],
      "description": "Optional descriptive title of a conciliar Constitution (mutually exclusive; omit for a plain constitution such as Sacrosanctum Concilium). Descriptive of purpose only — NOT a claim of authority, and unlike 'dogmatic-definition' it is not backed by any assessment."
    },
    "aliases": {
      "type": "array",
      "items": { "type": "string" },
      "description": "Alternative titles (e.g. 'The Gospel of Life'). Incipits live in the incipit field."
    }
  },
  "allOf": [
    {
      "description": "a minted id requires an incipit or a series (a series-form id is keyed by occasion, not by first words); a null genre requires the raw source label",
      "if": { "properties": { "idStatus": { "const": "minted" } }, "required": ["idStatus"] },
      "then": { "anyOf": [{ "required": ["incipit"] }, { "required": ["series"] }] }
    },
    {
      "description": "a series-form id is minted by rule (messages spec §3.2.2): a document with series set is never provisional",
      "if": { "required": ["series"] },
      "then": { "properties": { "idStatus": { "const": "minted" } } }
    },
    {
      "if": { "properties": { "genre": { "type": "null" } }, "required": ["genre"] },
      "then": { "required": ["sourceGenreLabel"] }
    },
    {
      "description": "a minted id is issuer/incipit-slug-year (or issuer/series-id-year), optionally extended to the full date to resolve an incipit collision",
      "if": { "properties": { "idStatus": { "const": "minted" } }, "required": ["idStatus"] },
      "then": {
        "properties": {
          "id": { "pattern": "^mag:[a-z0-9-]+/[a-z0-9]+(-[a-z0-9]+)*-[0-9]{4}(-[0-9]{2}-[0-9]{2})?$" }
        }
      }
    },
    {
      "description": "a provisional id is issuer/genre-slug-YYYY-MM-DD with an optional ordinal",
      "if": { "properties": { "idStatus": { "const": "provisional" } }, "required": ["idStatus"] },
      "then": {
        "properties": {
          "id": { "pattern": "^mag:[a-z0-9-]+/[a-z0-9]+(-[a-z0-9]+)*-[0-9]{4}-[0-9]{2}-[0-9]{2}(-[0-9]+)?$" }
        }
      }
    }
  ]
}
