[
  {
    "id": "mag:pius-xii/brief-1939-06-18",
    "title": "Breve Pontificio con il quale San Francesco d'Assisi e Santa Caterina da Siena vengono proclamati Patroni Primari d'Italia",
    "idStatus": "provisional",
    "genre": "brief",
    "issuerId": "rp:pius-xii",
    "issuerType": "pope",
    "date": "1939-06-18",
    "source": {
      "url": "https://www.vatican.va/content/pius-xii/it/briefs/documents/hf_p-xii_brief_19390618_patroni-italia.html",
      "shelf": "briefs",
      "languages": [
        "IT"
      ],
      "retrieved": "2026-09-07"
    },
    "sourceGenreLabel": "briefs"
  },
  {
    "id": "mag:pius-xii/summi-pontificatus-1939",
    "title": "Summi Pontificatus",
    "idStatus": "minted",
    "genre": "encyclical",
    "issuerId": "rp:pius-xii",
    "issuerType": "pope",
    "date": "1939-10-20",
    "source": {
      "url": "https://www.vatican.va/content/pius-xii/it/encyclicals/documents/hf_p-xii_enc_20101939_summi-pontificatus.html",
      "shelf": "encyclicals",
      "languages": [
        "EN",
        "ES",
        "FR",
        "IT",
        "LA",
        "PT"
      ],
      "retrieved": "2026-09-07"
    },
    "incipit": "Summi Pontificatus",
    "sourceGenreLabel": "encyclicals"
  },
  {
    "id": "mag:pius-xii/sertum-laetitiae-1939",
    "title": "Sertum Laetitiae",
    "idStatus": "minted",
    "genre": "encyclical",
    "issuerId": "rp:pius-xii",
    "issuerType": "pope",
    "date": "1939-11-01",
    "source": {
      "url": "https://www.vatican.va/content/pius-xii/it/encyclicals/documents/hf_p-xii_enc_01111939_sertum-laetitiae.html",
      "shelf": "encyclicals",
      "languages": [
        "EN",
        "IT",
        "LA",
        "PT"
      ],
      "retrieved": "2026-09-07"
    },
    "incipit": "Sertum Laetitiae",
    "sourceGenreLabel": "encyclicals"
  },
  {
    "id": "mag:pius-xii/asperis-commoti-1939",
    "title": "Asperis Commoti",
    "idStatus": "minted",
    "genre": "apostolic-exhortation",
    "issuerId": "rp:pius-xii",
    "issuerType": "pope",
    "date": "1939-12-08",
    "source": {
      "url": "https://www.vatican.va/content/pius-xii/it/apost_exhortations/documents/hf_p-xii_exh_19391208_asperis-commoti.html",
      "shelf": "apost_exhortations",
      "languages": [
        "IT",
        "LA"
      ],
      "retrieved": "2026-09-07"
    },
    "incipit": "Asperis Commoti",
    "sourceGenreLabel": "apost_exhortations"
  },
  {
    "id": "mag:pius-xii/letter-1940-01-07",
    "title": "Lettera al Presidente Franklin Delano Roosevelt in occasione della nomina di un Ambasciatore straordinario degli Stati Uniti d'America presso la Santa Sede",
    "idStatus": "provisional",
    "genre": "letter",
    "issuerId": "rp:pius-xii",
    "issuerType": "pope",
    "date": "1940-01-07",
    "source": {
      "url": "https://www.vatican.va/content/pius-xii/it/letters/documents/hf_p-xii_lett_19400107_memorable-message.html",
      "shelf": "letters",
      "languages": [
        "EN",
        "FR",
        "IT"
      ],
      "retrieved": "2026-09-07"
    },
    "sourceGenreLabel": "letters"
  },
  {
    "id": "mag:pius-xii/letter-1940-03-16",
    "title": "Lettera al Presidente degli Stati Uniti d'America, Franklin Delano Roosevelt",
    "idStatus": "provisional",
    "genre": "letter",
    "issuerId": "rp:pius-xii",
    "issuerType": "pope",
    "date": "1940-03-16",
    "source": {
      "url": "https://www.vatican.va/content/pius-xii/en/letters/documents/hf_p-xii_lett_19400316_presidente-usa.html",
      "shelf": "letters",
      "languages": [
        "EN"
      ],
      "retrieved": "2026-09-07"
    },
    "sourceGenreLabel": "letters"
  },
  {
    "id": "mag:pius-xii/saeculo-exeunte-octavo-1940",
    "title": "Saeculo Exeunte Octavo",
    "idStatus": "minted",
    "genre": "encyclical",
    "issuerId": "rp:pius-xii",
    "issuerType": "pope",
    "date": "1940-06-13",
    "source": {
      "url": "https://www.vatican.va/content/pius-xii/it/encyclicals/documents/hf_p-xii_enc_13061940_saeculo-exeunte-octavo.html",
      "shelf": "encyclicals",
      "languages": [
        "EN",
        "IT",
        "LA",
        "PT"
      ],
      "retrieved": "2026-09-07"
    },
    "incipit": "Saeculo Exeunte Octavo",
    "sourceGenreLabel": "encyclicals"
  },
  {
    "id": "mag:pius-xii/nosti-profecto-1940",
    "title": "Nosti profecto. - Nel IV centenario della fondazione della Compagnia di Gesù",
    "idStatus": "minted",
    "genre": "apostolic-letter",
    "issuerId": "rp:pius-xii",
    "issuerType": "pope",
    "date": "1940-07-06",
    "source": {
      "url": "https://www.vatican.va/content/pius-xii/it/apost_letters/documents/hf_p-xii_apl_19400706_nosti-profecto.html",
      "shelf": "apost_letters",
      "languages": [
        "IT",
        "LA"
      ],
      "retrieved": "2026-09-07"
    },
    "incipit": "Nosti profecto",
    "sourceGenreLabel": "apost_letters"
  },
  {
    "id": "mag:pius-xii/letter-1940-08-22",
    "title": "Lettera al Presidente degli Stati Uniti d'America, Franklin Delano Roosevelt",
    "idStatus": "provisional",
    "genre": "letter",
    "issuerId": "rp:pius-xii",
    "issuerType": "pope",
    "date": "1940-08-22",
    "source": {
      "url": "https://www.vatican.va/content/pius-xii/en/letters/documents/hf_p-xii_lett_19400822_presidente-usa.html",
      "shelf": "letters",
      "languages": [
        "EN"
      ],
      "retrieved": "2026-09-07"
    },
    "sourceGenreLabel": "letters"
  },
  {
    "id": "mag:pius-xii/norunt-profecto-1940",
    "title": "Norunt profecto",
    "idStatus": "minted",
    "genre": "motu-proprio",
    "issuerId": "rp:pius-xii",
    "issuerType": "pope",
    "date": "1940-10-27",
    "source": {
      "url": "https://www.vatican.va/content/pius-xii/it/motu_proprio/documents/hf_p-xii_motu-proprio_19401027_norunt-profecto.html",
      "shelf": "motu_proprio",
      "languages": [
        "ES",
        "IT"
      ],
      "retrieved": "2026-09-07"
    },
    "incipit": "Norunt profecto",
    "sourceGenreLabel": "motu_proprio"
  },
  {
    "id": "mag:pius-xii/letter-1941-06-29",
    "title": "Lettera ai Cardinali, ai Vescovi e agli Arcivescovi della Spagna in merito alla riorganizzazione delle Università Ecclesiastiche e dei Seminari",
    "idStatus": "provisional",
    "genre": "letter",
    "issuerId": "rp:pius-xii",
    "issuerType": "pope",
    "date": "1941-06-29",
    "source": {
      "url": "https://www.vatican.va/content/pius-xii/la/letters/documents/hf_p-xii_lett_19410629_card-vescovi-spagna.html",
      "shelf": "letters",
      "languages": [
        "LA"
      ],
      "retrieved": "2026-09-07"
    },
    "sourceGenreLabel": "letters"
  },
  {
    "id": "mag:pius-xii/letter-1941-07-12",
    "title": "Lettera al Consiglio Federale Svizzero",
    "idStatus": "provisional",
    "genre": "letter",
    "issuerId": "rp:pius-xii",
    "issuerType": "pope",
    "date": "1941-07-12",
    "source": {
      "url": "https://www.vatican.va/content/pius-xii/fr/letters/documents/hf_p-xii_lett_19410712_cons-fed-svizzero.html",
      "shelf": "letters",
      "languages": [
        "FR"
      ],
      "retrieved": "2026-09-07"
    },
    "sourceGenreLabel": "letters"
  },
  {
    "id": "mag:pius-xii/letter-1941-09-20",
    "title": "Lettera al Presidente degli Stati Uniti d'America, Franklin Delano Roosevelt",
    "idStatus": "provisional",
    "genre": "letter",
    "issuerId": "rp:pius-xii",
    "issuerType": "pope",
    "date": "1941-09-20",
    "source": {
      "url": "https://www.vatican.va/content/pius-xii/en/letters/documents/hf_p-xii_lett_19410920_presidente-usa.html",
      "shelf": "letters",
      "languages": [
        "EN"
      ],
      "retrieved": "2026-09-07"
    },
    "sourceGenreLabel": "letters"
  },
  {
    "id": "mag:pius-xii/cum-nobis-1941",
    "title": "Cum nobis",
    "idStatus": "minted",
    "genre": "motu-proprio",
    "issuerId": "rp:pius-xii",
    "issuerType": "pope",
    "date": "1941-11-04",
    "source": {
      "url": "https://www.vatican.va/content/pius-xii/la/motu_proprio/documents/hf_p-xii_motu-proprio_19411104_cum-nobis.html",
      "shelf": "motu_proprio",
      "languages": [
        "LA"
      ],
      "retrieved": "2026-09-07"
    },
    "incipit": "Cum nobis",
    "sourceGenreLabel": "motu_proprio"
  },
  {
    "id": "mag:pius-xii/haud-mediocrem-1941",
    "title": "Epistola Apostolica all'Episcopato della Bolivia circa lo sviluppo dei Seminari e la sempre più efficiente formazione del clero",
    "idStatus": "minted",
    "genre": "apostolic-letter",
    "issuerId": "rp:pius-xii",
    "issuerType": "pope",
    "date": "1941-11-23",
    "source": {
      "url": "https://www.vatican.va/content/pius-xii/la/apost_letters/documents/hf_p-xii_apl_19411123_episcopato-bolivia.html",
      "shelf": "apost_letters",
      "languages": [
        "LA"
      ],
      "retrieved": "2026-09-07"
    },
    "incipit": "Haud mediocrem",
    "sourceGenreLabel": "apost_letters"
  },
  {
    "id": "mag:pius-xii/letter-1942-03-07",
    "title": "Lettera al Maestro Generale dei Frati Predicatori, Rev.mo Padre Martino Stanislao Gillet, nella festività di San Tommaso d'Aquino",
    "idStatus": "provisional",
    "genre": "letter",
    "issuerId": "rp:pius-xii",
    "issuerType": "pope",
    "date": "1942-03-07",
    "source": {
      "url": "https://www.vatican.va/content/pius-xii/la/letters/documents/hf_p-xii_lett_19420307_padre-gillet.html",
      "shelf": "letters",
      "languages": [
        "LA"
      ],
      "retrieved": "2026-09-07"
    },
    "sourceGenreLabel": "letters"
  },
  {
    "id": "mag:pius-xii/letter-1942-04-15",
    "title": "Lettera all'E. mo Cardinale Luigi Maglione, Segretario di Stato: nuove suppliche alla Vergine per ottenere la pace nel mondo",
    "idStatus": "provisional",
    "genre": "letter",
    "issuerId": "rp:pius-xii",
    "issuerType": "pope",
    "date": "1942-04-15",
    "source": {